{
  "schema_version": 1,
  "preview_only": false,
  "brand": {
    "name": "TunaOS",
    "logo_url": "/logo.png",
    "favicon_url": "/favicon-32.png",
    "homepage_url": "https://tunaos.org",
    "documentation_url": "https://tunaos.org/docs/iso-builder",
    "support_url": "https://github.com/tuna-os"
  },
  "presentation": {
    "headline": "Make TunaOS your own",
    "intro": "Choose your desktop, apps and image settings.",
    "accent_color": "#5b9cf6"
  },
  "output": {
    "volume_label": "TUNAOS",
    "filename_prefix": "tunaos"
  },
  "default_selection": {
    "kind": "catalog",
    "variant": "yellowfin",
    "flavor": "gnome",
    "platform": "linux/amd64/v2"
  },
  "desktops": [
    {
      "id": "gnome",
      "name": "GNOME",
      "description": "A clean, focused desktop with an app overview.",
      "default_flatpaks": [
        "io.github.kolunmi.Bazaar",
        "org.mozilla.firefox",
        "org.gnome.TextEditor"
      ]
    },
    {
      "id": "kde",
      "name": "KDE Plasma",
      "description": "A familiar layout with a taskbar and lots of customization.",
      "default_flatpaks": [
        "io.github.kolunmi.Bazaar",
        "org.mozilla.firefox",
        "org.kde.kate"
      ]
    },
    {
      "id": "cosmic",
      "name": "COSMIC",
      "description": "Flexible workspaces with optional window tiling.",
      "default_flatpaks": [
        "io.github.kolunmi.Bazaar",
        "org.mozilla.firefox"
      ]
    },
    {
      "id": "niri",
      "name": "Niri",
      "description": "A scrolling, keyboard-focused window layout.",
      "default_flatpaks": [
        "io.github.kolunmi.Bazaar",
        "org.mozilla.firefox"
      ]
    },
    {
      "id": "xfce",
      "name": "XFCE",
      "description": "A lightweight, traditional desktop.",
      "default_flatpaks": [
        "io.github.kolunmi.Bazaar",
        "org.mozilla.firefox",
        "org.gnome.TextEditor"
      ]
    }
  ],
  "variants": [
    {
      "id": "yellowfin",
      "name": "AlmaLinux Kitten 10 (flagship)"
    },
    {
      "id": "bonito",
      "name": "Fedora 44"
    },
    {
      "id": "sailfin",
      "name": "openSUSE Tumbleweed"
    },
    {
      "id": "flounder",
      "name": "Debian 13 Trixie"
    },
    {
      "id": "grouper",
      "name": "Ubuntu 26.04"
    },
    {
      "id": "marlin",
      "name": "Arch Linux"
    },
    {
      "id": "skipjack",
      "name": "CentOS Stream 10"
    },
    {
      "id": "albacore",
      "name": "AlmaLinux 10"
    },
    {
      "id": "guppy",
      "name": "Gentoo (source-based)"
    }
  ],
  "curated_app_sets": [
    {
      "id": "bluefin-system",
      "label": "Bluefin core apps",
      "desktops": [
        "gnome",
        "xfce",
        "cosmic"
      ],
      "url": "https://raw.githubusercontent.com/projectbluefin/common/main/system_files/bluefin/usr/share/ublue-os/homebrew/system-flatpaks.Brewfile",
      "format": "brewfile"
    },
    {
      "id": "bluefin-full",
      "label": "Bluefin full desktop",
      "desktops": [
        "gnome",
        "xfce",
        "cosmic"
      ],
      "url": "https://raw.githubusercontent.com/projectbluefin/common/main/system_files/bluefin/usr/share/ublue-os/homebrew/full-desktop.Brewfile",
      "format": "brewfile"
    },
    {
      "id": "bluefin-dx",
      "label": "Bluefin developer apps",
      "desktops": [
        "gnome",
        "xfce",
        "cosmic"
      ],
      "url": "https://raw.githubusercontent.com/projectbluefin/common/main/system_files/bluefin/usr/share/ublue-os/homebrew/system-dx-flatpaks.Brewfile",
      "format": "brewfile"
    },
    {
      "id": "aurora-system",
      "label": "Aurora core apps",
      "desktops": [
        "kde"
      ],
      "url": "https://raw.githubusercontent.com/get-aurora-dev/common/main/system_files/shared/usr/share/ublue-os/homebrew/system-flatpaks.Brewfile",
      "format": "brewfile"
    },
    {
      "id": "aurora-full",
      "label": "Aurora full desktop",
      "desktops": [
        "kde"
      ],
      "url": "https://raw.githubusercontent.com/get-aurora-dev/common/main/system_files/shared/usr/share/ublue-os/homebrew/full-desktop.Brewfile",
      "format": "brewfile"
    },
    {
      "id": "aurora-dx",
      "label": "Aurora developer apps",
      "desktops": [
        "kde"
      ],
      "url": "https://raw.githubusercontent.com/get-aurora-dev/common/main/system_files/shared/usr/share/ublue-os/homebrew/system-dx-flatpaks.Brewfile",
      "format": "brewfile"
    },
    {
      "id": "zirconium",
      "label": "Zirconium apps",
      "desktops": [
        "niri"
      ],
      "url": "https://raw.githubusercontent.com/zirconium-dev/zirconium/main/mkosi.extra/usr/share/flatpak/preinstall.d/zirconium.preinstall",
      "format": "preinstall"
    }
  ],
  "ddi_channels": [
    {
      "id": "snowfield",
      "stem": "snowfield-ab",
      "name": "Frostyard Snowfield — GNOME (DDI)",
      "desktop": "gnome"
    },
    {
      "id": "snow",
      "stem": "snow-ab",
      "name": "Frostyard Snow — GNOME (DDI)",
      "desktop": "gnome"
    },
    {
      "id": "cayo",
      "stem": "cayo-ab",
      "name": "Frostyard Cayo — headless (DDI)",
      "desktop": "none"
    }
  ]
}
